{
  "schema_version": "1.4",
  "run_id": "19119dc3-d4d1-5aa3-a4fe-025650353d4f",
  "generated": "2026-10-12T19:03:33+00:00",
  "repository": {
    "commit": "6128d409753b75b49c9b9ac3e65451d2c2fb1f8e",
    "dirty": false,
    "untracked": []
  },
  "engine": {
    "package": "grc-evidence",
    "version": "2.2.0"
  },
  "base_version": "2.2.0",
  "scanners": {
    "semgrep": "1.178.0",
    "trivy": "0.74.0",
    "checkov": "3.3.19",
    "conftest": "0.70.1"
  },
  "config": {
    "file": "grc.yaml",
    "resolved": {
      "target": "app",
      "knowledge": "knowledge",
      "inventory": "ai-inventory.yaml",
      "conftest_inputs": [
        "k8s/**/*.yaml",
        "k8s/**/*.yml",
        "infra/**/*.tf",
        "ai-inventory.yaml"
      ],
      "checkov_frameworks": [
        "terraform",
        "kubernetes",
        "dockerfile"
      ],
      "checkov_skip_paths": [],
      "skip_paths": [],
      "semgrep_configs": [
        "policies/semgrep"
      ],
      "rego": [
        "policies/rego"
      ],
      "scanner_timeout": 900,
      "allow_external_symlinks": false,
      "window_start": null,
      "window_end": null,
      "window_max_gap_days": 7,
      "ledger": "evidence/ledger.jsonl",
      "people": "real",
      "people_salt_env": "GRC_PEOPLE_SALT",
      "github_repos": [],
      "github_branches": [],
      "github_scanner_jobs": [],
      "github_accepted_bots": [],
      "review_default": "1y",
      "review_by_type": [
        [
          "SOC 2 Control",
          "1y"
        ],
        [
          "ISO/IEC 42001 Control",
          "1y"
        ],
        [
          "EU AI Act Article",
          "1y"
        ],
        [
          "Crosswalk",
          "6m"
        ],
        [
          "Rego Policy",
          "6m"
        ],
        [
          "Semgrep Rule",
          "6m"
        ],
        [
          "Scanner Check",
          "6m"
        ],
        [
          "Scanner",
          "6m"
        ],
        [
          "Stack Component",
          "90d"
        ]
      ],
      "review_warn_before": "30d",
      "review_base": "fail"
    },
    "sha256": "f9e656b9ace010aba6148f4d05ad2e559c382643b1368d8d484b93e1a40f4887"
  },
  "outputs": {
    "findings.json": "76d38796c674fc48f34d83dc1a2157d38005138520a6ba1ca08ad6976c930a5f",
    "mapping.json": "f2dab86b50c04e4d3b74ac914a5fbfbc8ffb512d1f9131cd951222fea054fbf7",
    "oscal/component-definition.json": "32739bf247e56156ab8f1c4d37b261bb7115a6e37801e70fc73555e8ceadcbba",
    "oscal/assessment-plan.json": "2e77a81de1088a92e25588a56c1583581a56e46d02d12f93c8395e75072f66f0",
    "oscal/assessment-results.json": "1370d74d07a450389f176c44057ceec0f0c334a9a411b85abadba518e2726507",
    "report.md": "f2934fa0a25f509768ea5f485d11c85c00c1698f61178312dd260eaab4e956db"
  }
}
